commit	suite	mean_cer50k	max_cer50k	mean_bpb	memory_gb	status	description
f6344fb	gemma-o200k-100m-combo-lock192-seed	0.118700	0.118700	2.826402	2.4	keep	best 100m focused run: unshuffled source IDs with lock192 and structural hard anchors, no structural feature term
f6344fb	gemma-o200k-100m-unshuffled-lock192	0.118980	0.118980	2.832837	2.4	diagnostic	unshuffled lock192 carries nearly all 100m gain; hard anchors add a small extra improvement
368ca13	gemma-o200k-100m-shuffled-structural-seed	0.169480	0.169480	2.747018	2.4	keep	shuffle-invariant PageRank/entropy anchors survive ID shuffle and improve slim, but cannot recover unshuffled ID-order gains
368ca13	gemma-o200k-100m-shuffled-structural-seed-features005	0.171500	0.171500	2.745210	2.4	discard	adding low-weight structural features to shuffled hard anchors hurts 100m CER despite slightly better BPB
368ca13	gemma-o200k-100m-shuffled-structural-features005	0.179620	0.179620	2.778433	2.4	diagnostic	structural feature regularization alone gives a small shuffled 100m gain but is weaker than hard anchors
0c07f36	gemma-o200k-100m-deshuffle-freq-naive-lock192	0.839880	0.839880	5.332084	2.3	discard	literal frequency-rank renumbering with numeric-ID lock is catastrophic because target IDs are not frequency ranks
0c07f36	gemma-o200k-100m-deshuffle-freq-rank-lock192	0.786980	0.786980	3.185269	2.4	discard	hard-locking frequency ranks to target frequency ranks also breaks the graph search
0c07f36	gemma-o200k-100m-deshuffle-freq-rank-lock192-seed	0.662260	0.662260	3.092084	2.4	discard	structural seeds cannot rescue hard frequency-rank locks
0c07f36	gemma-o200k-100m-deshuffle-freq-rank-soft-w005	0.156560	0.156560	2.757639	2.5	diagnostic	soft frequency-rank proximity improves shuffled slim and structural anchors without hard rank locks
0c07f36	gemma-o200k-100m-deshuffle-freq-rank-soft-seed-w005	0.174560	0.174560	2.747361	2.5	discard	combining structural hard seeds with frequency-rank pseudo IDs hurts versus the soft rank prior alone
0c07f36	gemma-o200k-100m-deshuffle-freq-rank-soft-w002	0.179480	0.179480	2.761376	2.4	discard	soft frequency-rank prior weight 0.02 is too weak
0c07f36	gemma-o200k-100m-deshuffle-freq-rank-soft-w008	0.154280	0.154280	2.760338	2.4	diagnostic	soft frequency-rank prior weight 0.08 is close but weaker than 0.10
0c07f36	gemma-o200k-100m-deshuffle-freq-rank-soft-w010	0.153180	0.153180	2.756239	2.5	keep	best shuffled-compatible deshuffle result: frequency-rank pseudo IDs as a soft rank-proximity prior, no hard locks
0c07f36	gemma-o200k-100m-deshuffle-freq-rank-soft-w012	0.211580	0.211580	2.765480	2.4	discard	soft frequency-rank prior weight 0.12 crosses into over-regularization
0c07f36	gemma-o200k-100m-deshuffle-freq-rank-soft-w015	0.216020	0.216020	2.869298	2.4	discard	soft frequency-rank prior weight 0.15 over-constrains and regresses
0c07f36	gemma-o200k-100m-deshuffle-freq-rank-soft-w020	0.175960	0.175960	2.749669	2.4	discard	soft frequency-rank prior weight 0.20 is unstable and worse than 0.10
56c30af	gemma-o200k-1m-deshuffle-rank-soft-w010	0.318220	0.318220	2.797819	3.6	discard	soft frequency-rank prior needs more data; at Gemma to o200k 1m it regresses versus slim
56c30af	gemma-o200k-1m-unshuffled-lock192-seed	0.298040	0.298040	2.796424	3.6	diagnostic	true unshuffled low-ID lock plus structural anchors improves 1m but is weaker than adding structural features
56c30af	gemma-o200k-10m-deshuffle-rank-soft-w010	0.210820	0.210820	2.740789	2.3	diagnostic	soft frequency-rank prior becomes useful at 10m but remains far behind true unshuffled ID order
56c30af	gemma-o200k-10m-unshuffled-lock192-seed	0.162880	0.162880	2.824757	2.3	keep	true unshuffled low-ID lock plus structural anchors gives large Gemma to o200k 10m gain
56c30af	o200k-qwen36-1m-deshuffle-rank-soft-w010	0.291780	0.291780	2.740887	4.2	diagnostic	soft frequency-rank prior works better for o200k to qwen36 at 1m than for Gemma to o200k
56c30af	o200k-qwen36-1m-unshuffled-lock192-seed	0.270540	0.270540	2.688591	3.5	keep	true unshuffled low-ID lock plus structural anchors beats soft frequency-rank prior at 1m
56c30af	o200k-qwen36-10m-deshuffle-rank-soft-w010	0.128280	0.128280	2.680815	2.3	diagnostic	soft frequency-rank prior scales strongly on o200k to qwen36 at 10m
56c30af	o200k-qwen36-10m-unshuffled-lock192-seed	0.117900	0.117900	2.678676	2.3	keep	true unshuffled low-ID lock plus structural anchors remains best at 10m, but soft rank closes much of the gap
36ee2dc	mainu-gemma-o200k-1m-l192-seed-feat005	0.291580	0.291580	2.801695	3.6	diagnostic	structural feature regularization improves the lock192 1m branch but lock128 features are better
36ee2dc	mainu-o200k-qwen36-1m-l192-seed-feat005	0.270460	0.270460	2.697228	3.4	diagnostic	structural features barely improve lock192 on qwen 1m; wider locks matter more
36ee2dc	mainu-gemma-o200k-10m-l192-seed-feat005	0.167560	0.167560	2.818394	2.3	discard	structural feature regularization hurts Gemma to o200k at 10m
36ee2dc	mainu-o200k-qwen36-10m-l192-seed-feat005	0.120680	0.120680	2.682793	2.3	discard	structural feature regularization hurts o200k to qwen36 at 10m
36ee2dc	mainu-gemma-o200k-1m-l128-seed	0.292580	0.292580	2.792261	3.6	diagnostic	lock128 without structural features improves over lock192 but is not best
36ee2dc	mainu-o200k-qwen36-1m-l128-seed	0.274340	0.274340	2.692381	3.5	discard	lock128 is too narrow for o200k to qwen36 at 1m
36ee2dc	mainu-gemma-o200k-10m-l128-seed	0.166640	0.166640	2.827999	2.3	discard	lock128 regresses Gemma to o200k at 10m
36ee2dc	mainu-o200k-qwen36-10m-l128-seed	0.118920	0.118920	2.679712	2.3	diagnostic	lock128 improves over no run-time retune but remains behind tuned weight
36ee2dc	mainu-gemma-o200k-1m-l256-seed	0.294740	0.294740	2.795968	3.6	discard	lock256 is too wide for Gemma to o200k at 1m
36ee2dc	mainu-o200k-qwen36-1m-l256-seed	0.264340	0.264340	2.686236	3.5	diagnostic	lock256 is the right qwen 1m width before weight tuning
36ee2dc	mainu-gemma-o200k-10m-l256-seed	0.164120	0.164120	2.828891	2.3	diagnostic	lock256 ties the best retuned 10m widths but remains worse than the prior lock192 baseline
36ee2dc	mainu-o200k-qwen36-10m-l256-seed	0.118800	0.118800	2.670677	2.3	diagnostic	lock256 helps but is worse than tuned lock192 weight
36ee2dc	mainu-gemma-o200k-1m-l192-seed-feat005-w010	0.300720	0.300720	2.797889	3.6	discard	id proximity weight 0.10 over-regularizes Gemma to o200k at 1m
36ee2dc	mainu-gemma-o200k-1m-l192-seed-feat005-w002	0.293740	0.293740	2.792295	3.6	discard	id proximity weight 0.02 is too weak for the Gemma 1m feature branch
36ee2dc	mainu-gemma-o200k-10m-l192-seed-w010	0.164240	0.164240	2.822192	2.3	diagnostic	id proximity weight 0.10 is close but does not beat the Gemma 10m baseline
36ee2dc	mainu-gemma-o200k-10m-l192-seed-w002	0.166980	0.166980	2.826727	2.3	discard	id proximity weight 0.02 regresses Gemma to o200k at 10m
36ee2dc	mainu-o200k-qwen36-1m-l256-seed-w000	0.269380	0.269380	2.691501	3.5	discard	zero id proximity loses the qwen 1m lock256 prior
36ee2dc	mainu-o200k-qwen36-1m-l256-seed-w001	0.268060	0.268060	2.682147	3.4	discard	id proximity weight 0.01 helps but is not enough for qwen 1m
36ee2dc	mainu-o200k-qwen36-1m-l256-seed-w010	0.263480	0.263480	2.680085	3.4	diagnostic	id proximity weight 0.10 improves qwen 1m but 0.02 is better
36ee2dc	mainu-o200k-qwen36-1m-l256-seed-w002	0.261800	0.261800	2.684546	3.5	keep	best o200k to qwen36 1m result from tuned lock256 with light id proximity
36ee2dc	mainu-o200k-qwen36-1m-l256-seed-w003	0.264260	0.264260	2.686043	3.5	discard	id proximity weight 0.03 regresses versus 0.02 on qwen 1m
36ee2dc	mainu-gemma-o200k-1m-l128-seed-feat005	0.288880	0.288880	2.796215	3.6	keep	best Gemma to o200k 1m result: narrower low-ID lock plus structural feature regularization
36ee2dc	mainu-gemma-o200k-1m-l160-seed-feat005	0.293600	0.293600	2.792493	3.6	discard	lock160 with structural features is worse than lock128 at Gemma 1m
36ee2dc	mainu-gemma-o200k-1m-l224-seed-feat005	0.290300	0.290300	2.801927	3.6	diagnostic	lock224 with structural features is close but worse than lock128 at Gemma 1m
36ee2dc	mainu-gemma-o200k-10m-l160-seed	0.164120	0.164120	2.827457	2.3	diagnostic	lock160 ties lock256 but does not beat the prior lock192 baseline at Gemma 10m
36ee2dc	mainu-gemma-o200k-10m-l224-seed	0.166260	0.166260	2.824156	2.3	discard	lock224 regresses Gemma to o200k at 10m
36ee2dc	mainu-o200k-qwen36-10m-l192-seed-w000	0.120500	0.120500	2.683121	2.3	discard	zero id proximity is too weak for qwen 10m
36ee2dc	mainu-o200k-qwen36-10m-l192-seed-w001	0.120440	0.120440	2.681173	2.3	discard	id proximity weight 0.01 is still too weak for qwen 10m
36ee2dc	mainu-o200k-qwen36-10m-l192-seed-w010	0.117360	0.117360	2.676299	2.3	diagnostic	id proximity weight 0.10 improves qwen 10m but 0.02 is better
36ee2dc	mainu-o200k-qwen36-10m-l192-seed-w002	0.116900	0.116900	2.683781	2.3	keep	best o200k to qwen36 10m result from light id proximity on lock192
36ee2dc	mainu-o200k-qwen36-10m-l192-seed-w003	0.119960	0.119960	2.683165	2.3	discard	id proximity weight 0.03 regresses versus 0.02 on qwen 10m
d4a585e	mainu-gemma-o200k-1m-l128-seed-feat005-anneal0802	0.290240	0.290240	2.864484	3.6	discard	annealing ID proximity from 0.08 to 0.02 admits late noise and loses versus constant 0.05 on Gemma 1m
d4a585e	mainu-gemma-o200k-1m-l128-seed-feat005-anneal0500	0.291080	0.291080	2.861711	3.7	discard	removing ID proximity by the last round hurts Gemma 1m despite the same structural feature setup
d4a585e	mainu-gemma-o200k-10m-l192-seed-anneal1002	0.167320	0.167320	2.896471	2.4	discard	strong early ID proximity still over-constrains Gemma 10m even when decayed to 0.02
d4a585e	mainu-gemma-o200k-10m-l192-seed-anneal0500	0.161180	0.161180	2.902203	2.3	keep	best Gemma to o200k 10m result: use low-ID structure early, then decay smooth ID proximity to zero
d4a585e	mainu-o200k-qwen36-1m-l256-seed-anneal1002	0.262060	0.262060	2.750595	3.5	diagnostic	annealing from 0.10 to 0.02 is close but does not beat constant 0.02 on qwen 1m
d4a585e	mainu-o200k-qwen36-1m-l256-seed-anneal0501	0.266520	0.266520	2.751526	3.6	discard	decaying qwen 1m below the 0.02 prior loses precision
d4a585e	mainu-o200k-qwen36-10m-l192-seed-anneal1002	0.122780	0.122780	2.752701	2.3	discard	strong early ID proximity is actively harmful on qwen 10m even with a 0.02 final weight
d4a585e	mainu-o200k-qwen36-10m-l192-seed-anneal0501	0.121780	0.121780	2.750500	2.4	discard	decaying qwen 10m below the 0.02 constant prior loses the best light-ID ordering signal
d4a585e	mainu-gemma-o200k-10m-l192-seed-anneal0500-pow05	0.161040	0.161040	2.894284	2.3	diagnostic	faster ID-prior decay slightly improves Gemma 10m versus linear decay but is weaker than slow decay
d4a585e	mainu-gemma-o200k-10m-l192-seed-anneal0500-pow20	0.158320	0.158320	2.891293	2.3	keep	best Gemma to o200k 10m result: keep ID proximity through mid-rounds, then decay quadratically to zero
d4a585e	mainu-gemma-o200k-10m-l192-seed-anneal0501	0.161040	0.161040	2.893761	2.3	diagnostic	leaving a small final ID prior ties fast decay but loses to fully removing the late prior
d4a585e	mainu-gemma-o200k-10m-l192-seed-anneal0400	0.161560	0.161560	2.893205	2.3	discard	lower initial ID proximity underfits early Gemma 10m alignment versus starting at 0.05
d4a585e	mainu-gemma-o200k-10m-l192-seed-anneal0500-pow15	0.159000	0.159000	2.893595	2.3	diagnostic	slower-than-linear ID-prior decay is good, but slightly worse than quadratic timing
d4a585e	mainu-gemma-o200k-10m-l192-seed-anneal0500-pow30	0.160520	0.160520	2.911825	2.3	discard	holding the ID prior too long regresses versus the quadratic decay sweet spot
d4a585e	mainu-gemma-o200k-1m-l128-seed-common4-feat005	0.456660	0.456660	2.919011	3.7	discard	expanding hard structural seeds to of/and/to/a is unsafe and corrupts Gemma 1m assignment
1a8945b	mainu-gemma-o200k-1m-l128-seed-feat005-crib	0.287500	0.287500	2.863189	3.7	diagnostic	crib repair accepted zero moves; measured current-code rerun improves Gemma 1m but does not validate the crib selector
1a8945b	mainu-gemma-o200k-10m-l192-seed-anneal0500-pow20-crib	0.161160	0.161160	2.901552	2.4	discard	loose crib repair accepted alpha-to-digit hitchhikers and regressed, motivating source and class guards
6699e6b	mainu-gemma-o200k-10m-l192-seed-anneal0500-pow20-crib-tight	0.158260	0.158260	2.887742	2.4	keep	tight crib repair accepts one punctuation-newline move and gives a tiny Gemma 10m gain
6699e6b	mainu-o200k-qwen36-1m-l256-seed-w002-crib-tight	0.266740	0.266740	2.751201	3.5	discard	tight crib repair accepts zero moves and regresses versus the saved qwen 1m baseline
6699e6b	mainu-o200k-qwen36-10m-l192-seed-w002-crib-tight	0.123300	0.123300	2.752281	2.3	discard	tight crib repair accepts zero moves and regresses versus the saved qwen 10m baseline
